{
  "$schema": "https://json-schema.org/draft/2020-12/schema",
  "type": "object",
  "properties": {
    "eyebrow": {
      "type": "string"
    },
    "title": {
      "type": "string"
    },
    "categories": {
      "type": "array",
      "items": {
        "type": "object",
        "properties": {
          "id": {
            "type": "string"
          },
          "name": {
            "type": "string"
          }
        },
        "required": [
          "id",
          "name"
        ],
        "additionalProperties": false
      }
    },
    "items": {
      "type": "array",
      "items": {
        "type": "object",
        "properties": {
          "pane": {
            "type": "string"
          },
          "categoryName": {
            "type": "string"
          },
          "title": {
            "type": "string"
          },
          "image": {
            "type": "object",
            "properties": {
              "src": {
                "type": "string"
              },
              "alt": {
                "default": "",
                "type": "string"
              },
              "width": {
                "type": "number"
              },
              "height": {
                "type": "number"
              }
            },
            "required": [
              "src",
              "alt"
            ],
            "additionalProperties": false
          },
          "fullSrc": {
            "type": "string"
          }
        },
        "required": [
          "pane",
          "categoryName",
          "title",
          "image",
          "fullSrc"
        ],
        "additionalProperties": false
      }
    },
    "itemsByCategory": {
      "type": "object",
      "propertyNames": {
        "type": "string"
      },
      "additionalProperties": {
        "type": "array",
        "items": {
          "type": "object",
          "properties": {
            "pane": {
              "type": "string"
            },
            "categoryName": {
              "type": "string"
            },
            "title": {
              "type": "string"
            },
            "image": {
              "type": "object",
              "properties": {
                "src": {
                  "type": "string"
                },
                "alt": {
                  "default": "",
                  "type": "string"
                },
                "width": {
                  "type": "number"
                },
                "height": {
                  "type": "number"
                }
              },
              "required": [
                "src",
                "alt"
              ],
              "additionalProperties": false
            },
            "fullSrc": {
              "type": "string"
            }
          },
          "required": [
            "pane",
            "categoryName",
            "title",
            "image",
            "fullSrc"
          ],
          "additionalProperties": false
        }
      }
    },
    "hero": {
      "type": "object",
      "properties": {
        "title": {
          "type": "string"
        },
        "image": {
          "type": "object",
          "properties": {
            "src": {
              "type": "string"
            },
            "alt": {
              "default": "",
              "type": "string"
            },
            "width": {
              "type": "number"
            },
            "height": {
              "type": "number"
            }
          },
          "required": [
            "src",
            "alt"
          ],
          "additionalProperties": false
        },
        "breadcrumb": {
          "type": "object",
          "properties": {
            "home": {
              "type": "object",
              "properties": {
                "label": {
                  "default": "",
                  "type": "string"
                },
                "href": {
                  "type": [
                    "string",
                    "null"
                  ]
                }
              },
              "required": [
                "label",
                "href"
              ],
              "additionalProperties": false
            },
            "current": {
              "type": "string"
            }
          },
          "required": [
            "home",
            "current"
          ],
          "additionalProperties": false
        }
      },
      "required": [
        "title",
        "image",
        "breadcrumb"
      ],
      "additionalProperties": false
    }
  },
  "required": [
    "eyebrow",
    "title",
    "categories",
    "items",
    "itemsByCategory",
    "hero"
  ],
  "additionalProperties": false
}
