{
  "hero": {
    "title": "Gallery",
    "image": {
      "src": "/media/_external/demo.awaikenthemes.com/inclub/wp-content/uploads/2024/12/page-header-bg-1.jpg",
      "alt": ""
    },
    "breadcrumb": {
      "home": {
        "label": "Home",
        "href": "#"
      },
      "current": "Gallery"
    }
  },
  "eyebrow": "Our Gallery",
  "title": "Explore the Gallery",
  "categories": [
    {
      "id": "all",
      "name": "All"
    },
    {
      "id": "9",
      "name": "Business Conference 2026 (COX'S BAZAR)"
    },
    {
      "id": "8",
      "name": "Community Hall"
    },
    {
      "id": "6",
      "name": "Room"
    },
    {
      "id": "5",
      "name": "Cottage"
    },
    {
      "id": "4",
      "name": "Indoor"
    },
    {
      "id": "3",
      "name": "Outdoor"
    },
    {
      "id": "2",
      "name": "Swimming pool"
    }
  ],
  "items": [
    {
      "pane": "all",
      "categoryName": "Business Conference 2026 (COX'S BAZAR)",
      "title": "INDEX Honorable Directors & Leaders",
      "image": {
        "src": "/media/public/storage/images/admin/gallery/1gk0XLFyHQ9Vvd3mJnQB.webp",
        "alt": "INDEX Honorable Directors & Leaders"
      },
      "fullSrc": "/media/public/storage/images/admin/gallery/1gk0XLFyHQ9Vvd3mJnQB.webp"
    },
    {
      "pane": "all",
      "categoryName": "Business Conference 2026 (COX'S BAZAR)",
      "title": "INDEX Honorable Leaders",
      "image": {
        "src": "/media/public/storage/images/admin/gallery/h8slLPqdP1FfvD6MO9rI.webp",
        "alt": "INDEX Honorable Leaders"
      },
      "fullSrc": "/media/public/storage/images/admin/gallery/h8slLPqdP1FfvD6MO9rI.webp"
    },
    {
      "pane": "all",
      "categoryName": "Business Conference 2026 (COX'S BAZAR)",
      "title": "INDEX Honorable Leaders",
      "image": {
        "src": "/media/public/storage/images/admin/gallery/V5NHDu8nDj1keC16DPKs.webp",
        "alt": "INDEX Honorable Leaders"
      },
      "fullSrc": "/media/public/storage/images/admin/gallery/V5NHDu8nDj1keC16DPKs.webp"
    },
    {
      "pane": "all",
      "categoryName": "Business Conference 2026 (COX'S BAZAR)",
      "title": "INDEX Honorable Leaders",
      "image": {
        "src": "/media/public/storage/images/admin/gallery/PTwmBufNKJfUx3ird2Tz.webp",
        "alt": "INDEX Honorable Leaders"
      },
      "fullSrc": "/media/public/storage/images/admin/gallery/PTwmBufNKJfUx3ird2Tz.webp"
    },
    {
      "pane": "all",
      "categoryName": "Business Conference 2026 (COX'S BAZAR)",
      "title": "Directors",
      "image": {
        "src": "/media/public/storage/images/admin/gallery/IBtlbCA7SDxJdEYXepxr.webp",
        "alt": "Directors"
      },
      "fullSrc": "/media/public/storage/images/admin/gallery/IBtlbCA7SDxJdEYXepxr.webp"
    },
    {
      "pane": "all",
      "categoryName": "Business Conference 2026 (COX'S BAZAR)",
      "title": "Directors",
      "image": {
        "src": "/media/public/storage/images/admin/gallery/VqzJ1hGcvy9Z1wHXGPGV.webp",
        "alt": "Directors"
      },
      "fullSrc": "/media/public/storage/images/admin/gallery/VqzJ1hGcvy9Z1wHXGPGV.webp"
    },
    {
      "pane": "all",
      "categoryName": "Business Conference 2026 (COX'S BAZAR)",
      "title": "Directors",
      "image": {
        "src": "/media/public/storage/images/admin/gallery/eYpLISzdKwbWwTPWrNFi.webp",
        "alt": "Directors"
      },
      "fullSrc": "/media/public/storage/images/admin/gallery/eYpLISzdKwbWwTPWrNFi.webp"
    },
    {
      "pane": "all",
      "categoryName": "Business Conference 2026 (COX'S BAZAR)",
      "title": "Directors",
      "image": {
        "src": "/media/public/storage/images/admin/gallery/WEH9ziANttkxU4M9CeeN.webp",
        "alt": "Directors"
      },
      "fullSrc": "/media/public/storage/images/admin/gallery/WEH9ziANttkxU4M9CeeN.webp"
    },
    {
      "pane": "all",
      "categoryName": "Business Conference 2026 (COX'S BAZAR)",
      "title": "Directors",
      "image": {
        "src": "/media/public/storage/images/admin/gallery/8SnYwW5HOO6VftwqeaM2.webp",
        "alt": "Directors"
      },
      "fullSrc": "/media/public/storage/images/admin/gallery/8SnYwW5HOO6VftwqeaM2.webp"
    },
    {
      "pane": "all",
      "categoryName": "Business Conference 2026 (COX'S BAZAR)",
      "title": "Directors",
      "image": {
        "src": "/media/public/storage/images/admin/gallery/OK20Y8frYTUmiX9t9Twt.webp",
        "alt": "Directors"
      },
      "fullSrc": "/media/public/storage/images/admin/gallery/OK20Y8frYTUmiX9t9Twt.webp"
    },
    {
      "pane": "all",
      "categoryName": "Business Conference 2026 (COX'S BAZAR)",
      "title": "Directors",
      "image": {
        "src": "/media/public/storage/images/admin/gallery/iYqx1gQ9ayEvsz5YI6ngH4wR0tWh6Xs2jBbGGAvS.jpg",
        "alt": "Directors"
      },
      "fullSrc": "/media/public/storage/images/admin/gallery/iYqx1gQ9ayEvsz5YI6ngH4wR0tWh6Xs2jBbGGAvS.jpg"
    },
    {
      "pane": "all",
      "categoryName": "Room",
      "title": "Private Villa Room",
      "image": {
        "src": "/media/public/storage/images/admin/gallery/Q3GK7whgkOkjO7BgQu2kXevpN9zC3mezmVT66U7E.avif",
        "alt": "Private Villa Room"
      },
      "fullSrc": "/media/public/storage/images/admin/gallery/Q3GK7whgkOkjO7BgQu2kXevpN9zC3mezmVT66U7E.avif"
    },
    {
      "pane": "all",
      "categoryName": "Community Hall",
      "title": "Big Community hall.",
      "image": {
        "src": "/media/public/storage/images/admin/gallery/Lpv53X3uluGDdX2TjubTQvvhPlTLMbUZSfYXjwoC.png",
        "alt": "Big Community hall."
      },
      "fullSrc": "/media/public/storage/images/admin/gallery/Lpv53X3uluGDdX2TjubTQvvhPlTLMbUZSfYXjwoC.png"
    },
    {
      "pane": "all",
      "categoryName": "Outdoor",
      "title": "Lake view",
      "image": {
        "src": "/media/public/storage/images/admin/gallery/q8p34CHR1qFXapE4WFaqyh5EAYw9tqN7tpGsXTSy.png",
        "alt": "Lake view"
      },
      "fullSrc": "/media/public/storage/images/admin/gallery/q8p34CHR1qFXapE4WFaqyh5EAYw9tqN7tpGsXTSy.png"
    },
    {
      "pane": "all",
      "categoryName": "Swimming pool",
      "title": "swimming pool",
      "image": {
        "src": "/media/public/storage/images/admin/gallery/RDvE9Va8cZByyqd9tWfmIMHymFf13rYNgTupZdx5.png",
        "alt": "swimming pool"
      },
      "fullSrc": "/media/public/storage/images/admin/gallery/RDvE9Va8cZByyqd9tWfmIMHymFf13rYNgTupZdx5.png"
    },
    {
      "pane": "all",
      "categoryName": "Swimming pool",
      "title": "Round Swimming pool",
      "image": {
        "src": "/media/public/storage/images/admin/gallery/awrRTMhJzcdtWEbqUR3QnwkMWUwO5WSW2rFZeHpe.png",
        "alt": "Round Swimming pool"
      },
      "fullSrc": "/media/public/storage/images/admin/gallery/awrRTMhJzcdtWEbqUR3QnwkMWUwO5WSW2rFZeHpe.png"
    },
    {
      "pane": "all",
      "categoryName": "Room",
      "title": "Pool View Room",
      "image": {
        "src": "/media/public/storage/images/admin/gallery/c3n8cqOL1qyHMWJHhvpxLSEzTjT1CiyHfnACPuuC.jpg",
        "alt": "Pool View Room"
      },
      "fullSrc": "/media/public/storage/images/admin/gallery/c3n8cqOL1qyHMWJHhvpxLSEzTjT1CiyHfnACPuuC.jpg"
    },
    {
      "pane": "all",
      "categoryName": "Cottage",
      "title": "Cottage",
      "image": {
        "src": "/media/public/storage/images/admin/gallery/NT2iL1o8PM72omenm3LuOKSPC6t91hl7SUhX0Mdo.png",
        "alt": "Cottage"
      },
      "fullSrc": "/media/public/storage/images/admin/gallery/NT2iL1o8PM72omenm3LuOKSPC6t91hl7SUhX0Mdo.png"
    },
    {
      "pane": "all",
      "categoryName": "Outdoor",
      "title": "Reception",
      "image": {
        "src": "/media/public/storage/images/admin/gallery/y6yFZ66X1vhsQBT4GxEV6bxBNKqEyfUWshhLzXs0.png",
        "alt": "Reception"
      },
      "fullSrc": "/media/public/storage/images/admin/gallery/y6yFZ66X1vhsQBT4GxEV6bxBNKqEyfUWshhLzXs0.png"
    },
    {
      "pane": "all",
      "categoryName": "Outdoor",
      "title": "Gate",
      "image": {
        "src": "/media/public/storage/images/admin/gallery/n8KtRLCELyV0MRwt4CMZXNy4ZE0PORfNoVjlnwFZ.png",
        "alt": "Gate"
      },
      "fullSrc": "/media/public/storage/images/admin/gallery/n8KtRLCELyV0MRwt4CMZXNy4ZE0PORfNoVjlnwFZ.png"
    }
  ],
  "itemsByCategory": {
    "2": [
      {
        "pane": "2",
        "categoryName": "Swimming pool",
        "title": "swimming pool",
        "image": {
          "src": "/media/public/storage/images/admin/gallery/RDvE9Va8cZByyqd9tWfmIMHymFf13rYNgTupZdx5.png",
          "alt": "swimming pool"
        },
        "fullSrc": "/media/public/storage/images/admin/gallery/RDvE9Va8cZByyqd9tWfmIMHymFf13rYNgTupZdx5.png"
      },
      {
        "pane": "2",
        "categoryName": "Swimming pool",
        "title": "Round Swimming pool",
        "image": {
          "src": "/media/public/storage/images/admin/gallery/awrRTMhJzcdtWEbqUR3QnwkMWUwO5WSW2rFZeHpe.png",
          "alt": "Round Swimming pool"
        },
        "fullSrc": "/media/public/storage/images/admin/gallery/awrRTMhJzcdtWEbqUR3QnwkMWUwO5WSW2rFZeHpe.png"
      }
    ],
    "3": [
      {
        "pane": "3",
        "categoryName": "Outdoor",
        "title": "Lake view",
        "image": {
          "src": "/media/public/storage/images/admin/gallery/q8p34CHR1qFXapE4WFaqyh5EAYw9tqN7tpGsXTSy.png",
          "alt": "Lake view"
        },
        "fullSrc": "/media/public/storage/images/admin/gallery/q8p34CHR1qFXapE4WFaqyh5EAYw9tqN7tpGsXTSy.png"
      },
      {
        "pane": "3",
        "categoryName": "Outdoor",
        "title": "Reception",
        "image": {
          "src": "/media/public/storage/images/admin/gallery/y6yFZ66X1vhsQBT4GxEV6bxBNKqEyfUWshhLzXs0.png",
          "alt": "Reception"
        },
        "fullSrc": "/media/public/storage/images/admin/gallery/y6yFZ66X1vhsQBT4GxEV6bxBNKqEyfUWshhLzXs0.png"
      },
      {
        "pane": "3",
        "categoryName": "Outdoor",
        "title": "Gate",
        "image": {